question,option1,option2,option3,answer
When Aarav eagerly signs up for a pottery class despite never trying art before what trait is he displaying,Curiosity and openness,Risk avoidance,Routine preference,Curiosity and openness
While traveling abroad Riya immerses herself in local traditions and cuisine What does this reflect,Cultural openness,Comfort zone thinking,Detachment,Cultural openness
If Sneha enjoys exploring new technologies and ideas at work she is showing,Openness to experience,Task dependency,Rule orientation,Openness to experience
When Arjun questions traditional methods and experiments with creative ones it reflects,Innovative openness,Conventional thinking,Repetition,Innovative openness
During a brainstorming session Meera encourages wild ideas before narrowing them down What mindset does this show,Open and creative thinking,Controlled conformity,Fixed mindset,Open and creative thinking
Someone who appreciates global cultures and perspectives is showing,Openness to diversity,Comfort zone thinking,Reserved behavior,Openness to diversity
When Tanvi tries a new approach instead of repeating mistakes it reflects,Adaptability,Indifference,Stubbornness,Adaptability
People who constantly seek to understand why demonstrate,Curiosity,Resistance to learning,Rigidity,Curiosity
A person who prefers learning new things over following old patterns shows,Curiosity driven openness,Routine loyalty,Structured rigidity,Curiosity driven openness
If Aarush prefers routines and avoids surprises he likely has,Low openness,High flexibility,Curious temperament,Low openness
At work Riya’s willingness to learn new skills instead of fearing change reflects,Openness to experience,Self doubt,Routine preference,Openness to experience
When Aarav willingly tries unfamiliar food or travels alone it reveals,Curiosity and exploration,Perfectionism,Structured comfort,Curiosity and exploration
Reading diverse books and exploring new perspectives helps develop,Openness and empathy,Perfectionism,Rigidity,Openness and empathy
When a designer experiments with new ideas instead of repeating trends it shows,Creativity and openness,Risk aversion,Practical caution,Creativity and openness
When Meera explores topics outside her field out of curiosity she is displaying,Intellectual exploration,Task avoidance,Fear of change,Intellectual exploration
Someone who resists change or avoids new situations shows,Closed mindedness,Creative thinking,Exploration,Closed mindedness
Someone who explores different learning styles has a,Growth oriented mindset,Fixed mindset,Defensive habit,Growth oriented mindset
When Sneha asks deep questions and explores multiple answers it demonstrates,Curious thinking,Avoidance,Disinterest,Curious thinking
Teams high in openness tend to,Encourage innovative thinking,Resist risks,Prefer rules,Encourage innovative thinking
Someone who sees change as an opportunity rather than a threat is,Open to experience,Emotionally closed,Risk averse,Open to experience
A learner who takes interest in unfamiliar topics shows,Intellectual curiosity,Task distraction,Complacency,Intellectual curiosity
People high in openness often,Try new hobbies and perspectives,Stick to habits,Avoid challenges,Try new hobbies and perspectives
Open minded individuals usually,Experience and learn new things,Ignore change,Stay rigid,Experience and learn new things
When Dev enjoys traveling to unknown places his openness drives,Exploration and discovery,Routine and predictability,Restraint,Exploration and discovery
Openness helps teams by,Encouraging creative ideas and adaptability,Enforcing strict habits,Reducing experimentation,Encouraging creative ideas and adaptability
